{
  "version": 1,
  "artifact_id": "sha256:3333333333333333333333333333333333333333333333333333333333333333",
  "created_at": "2026-08-22T12:10:00Z",
  "repository": "berlinguyinca/autospec",
  "source_implementation": {
    "artifact_id": "sha256:2222222222222222222222222222222222222222222222222222222222222222",
    "digest": "sha256:ffffffffffffffffffffffffffffffffffffffffffffffffffffffffffffffff"
  },
  "producer": {
    "agent_id": "autospec",
    "harness": "pi",
    "bridge": "native",
    "provider_family": "local",
    "model": "deterministic",
    "session_isolation": "isolated",
    "access_mode": "read"
  },
  "base_commit": "1111111111111111111111111111111111111111",
  "head_commit": "2222222222222222222222222222222222222222",
  "changed_paths": ["scripts/autospec-handoff.py", "tests/pi-agent-handoff/test_handoff_cli.py"],
  "closeout": {
    "path": ".autospec/handoffs/901/closeout.json",
    "digest": "sha256:9999999999999999999999999999999999999999999999999999999999999999",
    "claims": [
      {
        "claim": "The handoff CLI validates all four artifact kinds.",
        "label": "verified",
        "proof_type": "runtime",
        "evidence": "bash tests/pi-agent-handoff/test.sh"
      }
    ]
  },
  "acceptance_criteria": [
    {
      "id": "AC-1",
      "text": "The handoff CLI validates all four version 1 artifact kinds.",
      "verification": "python3 -m unittest discover -s tests/pi-agent-handoff -v"
    }
  ],
  "rerun_commands": ["bash tests/pi-agent-handoff/test.sh"],
  "required_independence": {
    "provider_family": "openai",
    "session": "isolated"
  },
  "checks": [
    {
      "name": "handoff tests",
      "status": "pass",
      "evidence": "tests/pi-agent-handoff/"
    }
  ],
  "verdict": {
    "path": ".autospec/handoffs/901/verdict.json",
    "schema": "autospec-agent-handoff-result-v1.schema.json"
  }
}
